"author","score","upvotes","comment_id","thread","Cleaned_Comment"
"Fair_Onion_1289",7,7,"1",1,"able book follow end initial agree may helpful outline expectations happens follow session like topics might cover  structured often meet check  first started outpt counseling found assuming client knew lot helpful lay clearly think good save nutrition goal setting future follow sessions  really use first session establishing rapport getting thorough assessment  know assessment getting know history  come game plan together type follow works best also sometimes client stage change  meet first appmt never come back thankfully shared felt like ready time work mostly population see cold feet often"
"Top_Cherry_4663",2,2,"1_1",1,"yes typically book follow call  ones referring cancel due conflict say will reschedule less busy never many times  follow become nuisance lol thank helpful always start initial call telling today getting know history   help develop best plan moving forward clients  even  education goal setting others start briefly also discovery call expect sometimes sure well explaining maybe going wrong think struggle since individualized hard time verbalizing exactly expect agree point assuming client already knows  realized bit first started well thanks much"
"No-Needleworker5429",3,3,"2",2,"text message call week initial check goal confirm appointment ending first session clear statement  expect visit"
"Global-Complaint-482",1,1,"3",3,"couple ideas see often space seems work try rebook customers next session settling loyalty programs  need oldfashioned stamp cards many digital loyalty providers days will give access customer intelligence open pushnotification channels stampme chckn novel good old fashioned business cards hand customers ask recommend friends still works"
"Tophergabriel",6,6,"1",1," seen point click care matrix care ltc epic acute care"
"ninigotmac",2,2,"1_1",1,"used pcc current workplace uses matrixcare"
"Commercial-Sundae663",2,2,"2",2,"old hospital uses outpatient facilities prefer customizable easy read hopefully ltc facility"
"ninigotmac",1,1,"2_1",2,"hopeful time will tell"
"Mother_Upstairs9485",1,1,"3",3,"just labs notes epic everything else pcc"
"Away_Ad6913",1,1,"4",4,"love epic super easy read chart"
"ArtisticBuddy4897",1,1,"5",5,"anyone else hate point click care pcc"
"NoDrama3756",4,4,"1",1,"yes ask mma levels"
"Tiredloafofbread",3,3,"2",2,"tried order mma never got done patient needed fast hours something neither doctor ever ordered guess just  know sat pending weeks realized got transferred another ward fault honestly  think fasting always case yeah something consider decide order"
"Ambitious-Session157",3,3,"3",3,"always prefer  evidence deciding interventions recommendations case ask serum vit also due deficiancy instead"
"NoDrama3756",1,1,"3_1",3,"need mma levels"
"Both_Courage8066",99,99,"1",1,"right thing emailing advisor really shady intern thought  away"
"sebelay",86,86,"1_1",1,"went back forth awhile remembering much internship sucked really  need people like profession lol"
"ninigotmac",21,21,"1_1_1",1,"correct yes internship intense sometimes soulkilling depending program bigger issue integrity honestly expect serious disciplinary action program either case personally terminate precepting immediately absolutely deserving minute time"
"Ancient_Winter",16,16,"1_1_2",1,"regardless much internship may may suck fact intern photoshopped syllabus means misrepresenting dietetics program lying fellow dietetics professional able skimp baseline learning dietitian lack integrity ethical principles baseline requirements profession okay medical doctor photoshopping residency experience  less training honest drop internship outright behavior understand  difficult undertaking least please sure advisor creator syllabus whoever role aware full extent intended deception also consider important preceptor call talk student directly regardless program says"
"Platypus_Penguin",70,70,"2",2,"going  far career thinks  just cut corners blatantly lie like"
"DublinClover",30,30,"2_1",2,"unless looking apply food service management position "
"Educational_Tea_7571",1,1,"2_1_1",2,"nope even want kitchen run someone like lol know love hear complaints food right mean ltc practically managing half time inservicing staff anyway depending facility set gonna hear issues one way anotherlet alone face face patients anyway settings"
"DublinClover",2,2,"2_1_1_1",2,"making joke figured people  "
"Educational_Tea_7571",1,1,"2_1_1_1_1",2,""
"Cyndi_Gibs",31,31,"3",3," interns try fudge hours immediately contacted supervisor declined host absolutely infuriating"
"sebelay",17,17,"3_1",3,"shocked someone blatant syllabus sent pictures printed document lol assume maybe thought older less tech savvy  recognize photoshop"
"Cyndi_Gibs",8,8,"3_1_1",3,"insulting intelligence"
"maydayjunemoon",3,3,"3_2",3,"graduated someone fudged hours education program basically   away got away private agreement write paper volunteer hours community got highest paying job graduating class"
"Cyndi_Gibs",3,3,"3_2_1",3,"fuming god"
"maydayjunemoon",2,2,"3_2_1_1",3,"extremely frustrating"
"CatsAndSnacks13",23,23,"4",4,"yikes fairly new two years intern cohort never pulled shit like meanwhile   precepted interns since one awful one just going motions show morning tell leaving early football games vacation family  worklife balance butdude knew signing one goes dietetic internship blind respect education preceptors time"
"Sea-Tangerine-7158",18,18,"5",5,"crazy lol either lazy feels  take shortcut whatever reason"
"diabetesrd2020",18,18,"6",6,"girl seen crazy stuff girl know got bad evaluation final clinical eval given eval clinical preceptor changed whole eval years later passed"
"KickFancy",8,8,"6_1",6,"cheaters never win"
"diabetesrd2020",3,3,"6_1_1",6,"agreed"
"NoDrama3756",26,26,"7",7,"tell ass come reporting program cdr well"
"sebelay",23,23,"7_1",7,"lol  coworkers thought losing caring much"
"fundusfaster",21,21,"7_1_1",7,"person ruining others ones  succumb lazy victimhood learned incompetence pay education put hard work success expected subsidize lazy manipulative hear"
"Jeweles_07",12,12,"8",8,"man gonna future possibly"
"Hour-Technician-6787",8,8,"9",9,"yeah cool"
"Tdog412__",8,8,"10",10,"insane happy even found preceptor willing accept  even fathom trying something like people  understand much privilege somebody willing preceptor"
"MagicianVisual7302",7,7,"11",11,"absolutely right thing  need people like profession"
"whateverislovely",5,5,"12",12,"someone gonna lose internship lol"
"MidnightSlinks",17,17,"13",13,"bananas remote intern early covid bail entire week pick shifts restaurant job tried lie face working report got citations longer week see version history  opened last workdays program director asked sign hours anyway blacklisted whole school sending interns told chair department one asked take intern personal favor"
"sydandbeans",5,5,"14",14,"program  strictly warned hrs internship even meet hours still scheduled come also say preceptor signs says  early  will  kicked program immediately scared even think pulling anything ultimately prepare dietitian put reputation line football game crazy worked hard already"
"TinyFroyo7461",4,4,"15",15," think anyone going  mad  struggled internship trying cheat cut corners nope understand hard time wanted try see  away asking photoshopping syllabus bad"
"PositiveOk178",4,4,"16",16," accustomed integrity"
"Early_Tie9620",2,2,"17",17,"omg internship sucks never even imagine learn prepare entrylevel careers exposure  truly  even enough even though want longer strange thought control situation rotation actual preceptor"
"Away_Ad6913",2,2,"18",18,"currenlty intern almost done  even imagine dishonest disrespectful preceptors taking student way ever try like especially since paid lot money become rdn really hope intern gets terminated program least reprimanded"
"DublinClover",4,4,"1",1,"form expedited immigration certain people needed professions expensive like good look "
"texassized_104",2,2,"2",2," looked apparently will required retake board exam order legally practice canada"
"lenjac",5,5,"1",1,"pretty sure bright beginnings discontinued best best switch something like orgain plant ripple kids kate farms"
"Full_FrontaI_Nerdity",2,2,"1_1",1,"interesting note regarding orgain wrote asking share data heavy metals products instead answering wrote back rambling vaguelyworded response ultimately said  test products rather assume done upstream ingredient supply chain context asked seeing report came recently heavy metals protein drinks pinned organic plantbased chocolate shakes worst offenders brand exceptions orgain one  touched orgain chocolate protein powder since practically brand new tub anyone knows find information orgain products please help"
"theloudestmanhattans",1,1,"1_1_1",1,"link know published interested read"
"Full_FrontaI_Nerdity",1,1,"1_1_1_1",1,"  phone cooperate right  link study article conducted clean label project"
"theloudestmanhattans",2,2,"1_1_1_1_1",1,"thank"
"cclrd93",1,1,"1_2",1,"thank"
"[deleted]",1,1,"1",1,"needs make sure future employer whether actually needs physical license hand application approval process will suffice  licensed considering provide virtual nutrition counseling  heard stories apparently company  still see patients long application sent provide copy app course  differ employer employer worth asking "
"Max_Production",2,2,"1_1",1,"apps ask youre licensed state helpful know company policy acknowledges app submitted wont make wait months needed approval driving springfield moment will post update wish luck walk license hand"
"OcraftyOne",102,102,"1",1,"almost years hell focus model sorry three new grad hires hospital two failed exam twice  rooting hard dd"
"SaladsAreYuck",28,28,"1_1",1,"almost years question models never heard"
"[deleted]",12,12,"1_1_1",1,"right never heard either  seasoned academy cdr people know  explain sound like people ever failing exam first even second third etcattempt   ever recall many stories facebook people failing like either unheard easier test plus years ago took exam  social media share  know back either way  curious pass fail rate trend time "
"KickFancy",3,3,"1_1_1_1",1,"lot higher previous years believe current first attempt pass rate"
"Tasty_Evidence_9519",2,2,"1_1_1_2",1,"glad one  know lol coordinated program graduated one failed test bet exams harder drove exam two days wedding sobbing fight brother still passed first time  amazing student either untreated adhd"
"Due_Distribution2139",1,1,"1_1_1_3",1,"working lot seasoned rds exams like studied inman questions exam passed right  infuriating just finished fall terrified stories heard worked ndtr ten years still bought voucher second test hearing andto top cdr academy made statement exam academia fault sorry pearson products  trusted provide quality material since anatomy physiology classes like decade ago math course used pearson products literally just gave points exams every single one errors"
"StrawberryLovers8795",63,63,"2",2,"think exam important programs created equal also wish clinical focused gets tricky  know new studies guidelines going released may considered standard practice may change overnight students stay date  penalized exam hasn caught yet felt jean inman reflective exam took person course good luck second try"
"Little-Basils",28,28,"2_1",2,"fight way relearning food service program classes open book team tests none info stuck felt like god also idiot day made connection scoop numbers many size scoop goes quart"
"SlowBanks",24,24,"2_1_1",2,"yes crucial information scoop numbers"
"nman4141",2,2,"2_1_2",2,"seem common theme undergrad similar situation masters classmates come dpds seem report similar findings food service management classes seem always online open note open book exams also circles experience lecturer seemed focused job actually teaching course seems strange mnt food science community classes depth well taught fsm seems regularly fail meet mark"
"Cyndi_Gibs",3,3,"2_1_2_1",2,"undergraduate food service classes rigorous professor taught curriculum included total  best professor department connected everything internship dietetic practice rigorous testing high standards pass sad hear programs  give fsm due"
"StrawberryLovers8795",2,2,"2_1_2_1_1",2,"mine also mnt teacher head clinical section coordinated program"
"Chad_RD",-3,-3,"2_1_2_2",2,"people fsm easy nothing wrong going attract people care less additionally lot people fsm kinda just like lording people far test harder may people currently kinda shit taking tests"
"Karmic_Cup_96",2,2,"2_1_2_2_1",2," know whether respond professional say gross generalization say  asshole"
"Mapleybacon",20,20,"3",3,"exam clinical focused  getting clinical questions wrong gave adaptive exam"
"Mapleybacon",27,27,"3_1",3,"also like add work food service hospital actually need use many food service concepts learned school really bothers many dietetics student completely discount food service extremely important aspect healthcare feel blessed  develop menus nutritious high quality food patients improve intake"
"boilerbitch",16,16,"3_1_1",3,"clinical frustrates well  imagine much frustrated must feel love foodservice rds help really wish hospital one"
"Cyndi_Gibs",2,2,"3_1_2",3," work food service invested fsm classes undergrad loved work thought invaluable tried instill values students worked"
"ithinkinpink93",5,5,"3_2",3,"yes adaptive will test weaker skills skills less interest usually equates less time attention topics"
"Several-Rock344",1,1,"3_3",3,"took exam paper like years ago never heard adaptive exam wtf old assume exams disciplines adaptive well"
"EnvironmentalSet7664",2,2,"3_3_1",3,"cousin just took exam become lpn passed yay also adaptive guess new thing right "
"Bluepie19",17,17,"4",4,"understand frustration passed exam years ago empathize expertise also clinical thought exam lot silly questions like ones described certain questions felt like test memorize exact thing rather testing ability reason think problem unfortunate sure exam used took excelled specific area got less questions tell knew stuff maybe knew good clinical started asking lots types questions unfortunately just study whatever test even never use practice best luck"
"Due_Distribution2139",3,3,"4_1",4,"think primary issue within domain many things know adaptive miss certain domain questions going  within domain picks weakest link friend mine nurse said tests even decades ago set way  just hard set questions will pulls database thousands questions even idea going tested futile field dietetics just vast vast honestly know depth every intricate detail clinical management food service just kind unrealistic ndtr exam ten years ago also adaptive similar setup know less questions exam  think aspect really causing major issues questions whatever changes made years back algorithms test seen huge decline passing scores cdr academy refuse take accountability blaming academia students fault pearson run test  trust products"
"NoSinger2259",12,12,"5",5,"understand going time exam  working year field really hard time passing tutor  take exam next month last time will agree measure will  praised bosses time excellent clinician heavy load carry passing understand  spent thousands exam study material tutors got"
"Several-Rock344",3,3,"5_1",5,"good luck"
"Charming_Shift9923",60,60,"6",6,"understand frustration felt way testing  side think important standard excellence within field opinion exam easy pass undermine credibility fighting profession"
"Competitive-Ad8434",35,35,"6_1",6,"think possible standard excellence testing also providing questions actually revelant work dietitians"
"Ruth4-9",10,10,"6_2",6,"think cdr learn streamline real world information students need know waste talent money many people passing exams lack clarity students expect prepare unless pay dollars pocket testing service may really enforcing learning models terms exam uses"
"bl0ss0ms",7,7,"6_3",6,"need complete dpd program master degree internship standard excellence finishing even bother really adaptive testing gotcha kind testing mentality  reflect entirety program dietitians must complete test reflect program courses percentage questions asked mirroring amount importance given one"
"EnvironmentalSet7664",3,3,"6_3_1",6,"agreed exactly cdm exam amount questions domain reflects proportions training program cdr adapting questions weak areas almost feels like want people fail"
"Due_Distribution2139",3,3,"6_3_1_1",6,"yea  see testing model good fact just much know amount information domain kind insane ndtr just finished program culinary degree worked clinically ndtr ten years honestly bought voucher second test one shit taking tests two heard many horror stories confidence level negatives"
"inside-the-madhouse",9,9,"7",7,"guess  make sure study stupid acronyms professors said  expecting bunch nutrition support calculations forth exam"
"ithinkinpink93",6,6,"7_1",7,"things often seem silly  used seen used practice yet never know skills knowledge will need job never know dietetics job will take versatile may well project manager one day went clinical inpatient peds ltc management  academia use different skills  immediate frustration try better outlook  know future holds learn disappointments flexible"
"inside-the-madhouse",8,8,"7_1_1",7,"thanks advice nontraditional student though  spent last decade managing school food program still fan acronyms"
"datafromravens",7,7,"8",8," test focus areas well remember much clinical mine either strongest subject"
"detricksnyder",2,2,"8_1",8,"believe amount questions domains constant yes seem remember something like subdomains  initial questions correct become less likely come later years tho forget"
"Novel_Captain_7867",6,6,"9",9,"cdre canada exam currently expert review problem voices candidates perplexed narrowed arbitrarily framed questions"
"KickFancy",2,2,"9_1",9,"canadian dietitian study group studying exam passed said cdre taking questions people keep getting wrong"
"TheGirlInTheBox",14,14,"10",10,"new rdn definitely feel frustrations took two tries pass exam felt ready times weakest domain business management stuff ridiculous imo bright side  email regarding survey rdns take skills used actual practice maybe will make changes reflect feedback soon"
"Advanced-Ad9686",1,1,"10_1",10,"right  back studying think just want stop point weeks since took exam failed just feeling hopeless point took exam failed"
"Fit_Hovercraft_7409",4,4,"10_1_1",10," give  already come far will eventually pass will worth exam ridiculous many amp will succeed  got"
"Advanced-Ad9686",1,1,"10_1_1_1",10,"means much"
"TheGirlInTheBox",1,1,"10_1_2",10,"got always feels like big thing  side"
"Advanced-Ad9686",2,2,"10_1_2_1",10,"just know message helped finally start studying today dreadful kept thinking point studying going fail anyways glad"
"TheGirlInTheBox",1,1,"10_1_2_1_1",10,"glad hear  dare give got taking one step time definitely better giving took couple weeks pick studying back failed natural reaction"
"road2health",5,5,"11",11,"study study resources long  took exam long ago thought weird pretty similar study resources "
"Several-Rock344",5,5,"12",12,"ive years worked one best hospital systems nyc years wtf focus model"
"Aggravating_Court_40",5,5,"13",13,"never heard focus lol totally fail exam miserably take today years seriously zero chance come close passing"
"SailingRD",4,4,"14",14,"swear exam  contain single thing studied studied inman visual veggies way seemed like test testing reasoning logic rather knowledge took year half ago also felt like one question insultingly easy"
"TheCHFDietitian",3,3,"15",15,"long time remember feeling way many questions felt like minutiae  seem reflect taught  seem important big picture remember taking cnsc years later difficult extremely useful clinical"
"blondee84",4,4,"16",16," use everything exam remember dietitians work clinical test areas exam took years ago big focus management remember lot people complaining planning working clinical always wanted fsm see applicable years working dietitians various roles learned lot applicable people think promise use info lot think management entrepreneurial roles especially also communicating leadership nonmedical staff members almost certainly least kpis human resources tasks surprised comes throughout career grow"
"Puzzleheaded-Monkee",7,7,"17",17," understand types exams continue exist come far dietetics student able practice one ducking exam ask may best future clinician one including will never know cdr brilliant reasoning  fucking way  hell"
"Advanced-Ad9686",2,2,"17_1",17,"feeling right  exam biased like lot people looking food service ugh"
"Bwrw_glaw",5,5,"18",18,"definitely understand frustration biggest frustration took food service management day wish consider splitting different focuses point education internship want focus clinical management outpatient  interested food service time maybe add regulatory stuff smaller amount clinical  kinda like mds specialties residency little broad still flexibility said look focus model clinical department uses variation time literally anytime project thinking terms may day day patients likely will practice working hospital"
"AutoModerator",2,2,"19",19,"title indicates may student looking advice may interested crossposting rdb new subreddit dietetic students interns rdbs share dieteticsrelated information support bot action performed automatically please contact moderators subreddit message compose dietetics questions concerns"
"HokieGalFurever540",2,2,"20",20,"took cert exam fall yes older dirt exam just major changes better said thought loser passing couple points found several years later changes students knew nothing eligible failed test first try many complaints academy changed format"
"spiderguin",2,2,"21",21,"years since took exam remember focus never use lol weirdly enough great business food service classes still weakest point test absolutely brutal test will definitely roast alive  totally  mean exam grift even introducing multitest payment expect many retake sounds like scam said please   discouraged try switch study style look new study techniques will fit day even changing study location  help remember best advice ever got  try study much brain needs rest retain information book next exam months study sections felt weakest weeks exam  review clinical notes stuff already pretty strong  definitely pass"
"Several-Rock344",2,2,"22",22," worry passing woman work try times pass smart just focus pun intended giving want exam  know academy looking ddd"
"samkRD",2,2,"23",23,"failed exam four times fifth attempt finally passed agree insulting use research job rarely food service  "
"DietitianSpecies5618",2,2,"24",24,"took exam almost years ago agree absurd hear interns hasn changed seems like cdr took random bits trivia dietetics threw questions actually relevant dietitian sector less frustrated cdr produced exam included questions actually use random management models entirely useless supervisor manager"
"Electronic_Blood7212",1,1,"25",25,"currently student hoping  pass first attempt"
"Ruth4-9",2,2,"25_1",25,"definitely recommend studying everyday basically full time job take notes learn read test quiz thought pocketprep visual veggies helpful tools cdr exam questions reflective pocketprep areas difficulty similar took exam past year  definitely pass"
"Electronic_Blood7212",1,1,"25_1_1",25," graduating bachelors year starting grad school fall already heard lot exam"
"diabetesrd2020",1,1,"26",26," hope pass next try former coworker mine passed try"
"KickFancy",1,1,"27",27,"heard program gave pass class thorough agree crazy amount emphasize food service management models"
"CatsAndSnacks13",1,1,"28",28,"pass fail exam still pretty ridiculous passed first time years ago back thought smart clinical dietitian  much continue learn every day even things thought knew  stumped  precept tell interns exam measure know really just ability rationalize memorize never extrapolate information standardized testthe ifs absolutely matter  actually working real world"
"Advanced-Ad9686",1,1,"29",29,"failed third time"
"Parking_Anywhere_28",1,1,"29_1",29,"failed exam times keep touch past professor recently told exam poorly designed set fail said exam review  take fails personally just keep taking exam pass hearing made feel better recently failed exam  life setbacks along way makes hard focus really believe  overcome"
"Advanced-Ad9686",1,1,"29_1_1",29,"needed hear today thank much"
"ZealousidealCarob540",1,1,"30",30,"someone explain like adaptive testing means focus weakest areas help field  understand like never going food service ton clinical communityso ideally rds test favorright also explains recently failed csp exam ive taken passed every time time repeatedly kept asking tpn cystic fibrosis questions like absurd amount even though studied areas pediatric expertise clinical community gtubes nicu picu infant toddler wic school lunchesetc failed flabbergasted literally kept asking questionsi always refer cystic fibrosis  done tpn ever questions say tpn cystic fibrosisso adaptive  kept getting questions wrong study competencies"
"Mammoth_Cranberry503",1,1,"31",31,"yup agree exam bullshit failed first time last fall passed second time winter"
"Plus-Pin-9157",0,0,"32",32,"took exam years ago horrible back well tons food service related questions literally nothing studied school tons questions answers ambiguous passed skin teeth went become excellent clinician yeah writes exams touch  food service often part dietitian realm ridiculous remember one question talking  size peaches calculate volume peaches per case meanwtf "
