"author","score","upvotes","comment_id","thread","Cleaned_Comment"
"Bwrw_glaw",22,22,"5",5,"combination things insurance reimbursement services limited still hospitals clinics  bill service costing money scope changed time people understand pay hasn changed scope womandominated field many women field partner earns well willing take lower paying jobs depresses pay everyone part unionized compare nursing union strong managers part great advocating better pay teams  write job descriptions way warrants higher pay"
"Weekly-Dig-9516",5,5,"5_1",5,"agree unfortunately everybody significant makes quite bit money even still respected feel like lot rd  see point view work  taking lot nursing duties even though  bill duties taking workload nurses  work think lead higher pay well "
"Bwrw_glaw",5,5,"5_1_1",5,"  even spouse anxious financial vulnerability feel comfortable low pay much overlaps nurse case managers yet  way better pay"
"Weekly-Dig-9516",2,2,"5_1_1_1",5,"lot use fine getting done free since  getting pay increase"
"NWSRD",14,14,"6",6,"woman dominated industry much like teachers also underpaid appreciated"
"Total-Scheme-1215",29,29,"7",7,"mostly education teachers paid well jobs generate immediate profit salaries increase follow money"
"hippiecat22",2,2,"7_1",7,"depends state teachers make great money year"
"Weekly-Dig-9516",3,3,"7_1_1",7,"agree pay just going inflation everyone else increase pay "
"PresentVisual2794",11,11,"8",8," generate money anyone costsavings profession healthcare profits selling goods services people sick always profitable sell pill provide surgery prevent first place"
"No-Cat-5811",4,4,"8_1",8,"definitely agree fact  generate money  clearly tie back one biggest reasons  think part saying costsavings pushing pills relying sick population fair say cost saving money generating think issue rds  concrete roi track medicare reimbursement usually commercial eventually follows suit big changes pts ots slps audiologists cost savings aspect allied health professions sell largely services rather product still make far dietitians look historical progression insurance coverage professions services pretty mind blowing  clearly see dietitians last allied health covered medicare still far behind mnt act bill presented last congresses  died year sessions due inaction even bipartisan support cosponsored republican democrat mix yet never prioritized enough vote senate house therefore died every years  reintroduced every new congress bill greatly expand coverage medicare finally concrete roi trace back"
"Ambitious-Session157",8,8,"9",9,"one makes annually spouse makes director nonclinical role working corporate grocery chain spouse store director furniture store chain"
"phonetic_luck",5,5,"9_1",9,"ooh side note always interested daytoday looks like job setting  mind sharing"
"Ambitious-Session157",5,5,"9_1_1",9,"collaborate food distributors brands vendors pertinent department managers promote products dietitianrelated communications increase sales among target consumers specific needs heart health diabetes budgetfriendly recipes feeding large families responsible multimillion dollar budget design implement evaluate consumer employer wellness programming handle monthly average caseload patients mnt provide nutrientdrug nutrientherb drugherb interactions education pertinent pharmacy patients receiving new drug prescriptions indicated concerns manage team food demonstrators implement dietitiansupported food sampling meet current consumer health wellness interests create deliver nutrition presentations high school athletics medical providers cme credits senior community centers workplace wellness schools food shelves  encourage health behavior changes exhibit positive health outcomes represent company media including television radio newapaper magazines support health wellness mitigate consumer distress recently news segment talking reasons egg prices substitutions eggs cooking baking affordable protein choices available"
"Turbulent_Spend_6480",1,1,"9_1_2",9,"loooove know well"
"Jujbear",7,7,"10",10,"many many reasons opinion field disproportionately composed decently well white women financial support family spouse fall back demanded sought higher pay people take low paying positions  questioning rds took low paying roles hospitals increase either salary benefits attract better applicants women tend ask raises negotiate salary aggressively men though think changing still keeps average pay profession whole others said  bring much money hospitals health system profit going valued making patient experience better  impact bottom line hospital ownership awful true  strong union way nurses healthcare professions  level education allied professions fact new masters requirement broad  help increase standing much academy seems largely touch inadequate terms advocating"
"EveryProfession5441",8,8,"11",11,"rds often seen redundant  seen lunch ladies also look much people weigh people like  "
"dmnqdv1980",31,31,"12",12,"book spells dietitian dietician  burn"
"bluecheeseanus",5,5,"12_1",12,"way spelled  really take much offense lol just"
"lush_rational",3,3,"12_2",12,"report whenever see websites sure  autocorrect spellcheck spell correctly"
"rlpsc",8,8,"12_3",12,"bad sorry fixed guess new word always called nutritionists saw growing  confusing cian words like pediatrician"
"SquatsAndAvocados",2,2,"12_4",12,"old spelling still used outside hasn long decided use instead"
"wingdings5",6,6,"13",13,"malnutrition bread butter physician still document insurance wont reimburse malnutrition exclusively note therefore terms generating revenue organization  provide much"
"mar621",6,6,"14",14,"poor negotiation skills things free  recognized end backfires  generate"
"Dsplcmnt-f-thngs0_o",6,6,"15",15," useful pharmaceutical companies shitty food companies since tell patients things  improve health therefore decreasing reliance money making products nurses help facilitate money flow plus  heartstrings "
"ks4001",6,6,"16",16,"pts require doctorate appropriate comparison"
"Educational_Tea_7571",5,5,"17",17,"figure  know sick"
"genecrazy",3,3,"18",18,"experience nothing undervalued respect weak academy little advocate heard allied health professionals stronger organization compared"
"spacelumieree",3,3,"19",19,"depends specialty inpatient hospital settings public health environment will lower range outpatient rds make due billing insurance certain preventative services diabetes ckd medicare obesity eating disorders general nutrition counseling baffle require supervised practice plus master degree pay competitive compared healthcare fields outpatient socal feel satisfied income fight hard  positives life work balance flexibility less stress physical labor compared say nurses"
"Deadellatrombone",3,3,"20",20,"think facilities  think rdns essential employees like nurses doctors instead rdns nice society undervalues benefits nutrition overall impact health also think part system fixing people diets prevents sickness whereas system built around treating sickness"
"SquatsAndAvocados",3,3,"21",21,"make anyone money  provide many billable services procedures aside tube placement clinical dietitians  privileges knowledge considered common knowledge easily googleable  understand sentiment extent became dietitian late previously spending year learning diet exercise losing meaningful amount weight  help dietitian better one yes  know time plus much weight loss lots specialists avenues  towards still employing comes loss org"
"TerribleBobcat2391",2,2,"22",22,"historically allowed service billed food service see expense changed  bill medical insurance hospitals still see negative budget short allowed put kitchen back bathrooms  dietitians making good money private practice just need learn stand make scene refuse work terrible pay"
"Several-Rock344",2,2,"23",23,"mostly women ¬£¥"
"lpj1299",1,1,"24",24,"well love never work day life sub good place see working dietitians love lot planning escape route"
"Past-Competition13",1,1,"25",25,"lot facilities  billing insurance services many cases salary paid revenue generating departments advocate coverage services lacking"
"rashnull",1,1,"26",26,"telling people eat less walk   paid much"
"DietitianE",1,1,"27",27,"factors lack insurance reimbursement female dominated field historically associated food nutrition undervalued care associated women work sexism dominated many coming affluent backgrounds biggest employers companies like sodexo morrison clinical nutrition companies food service environmental services contact companies offer nutrition services aside generally  pay well lack knowledge think smaller factor others many jobs ppl idea make decent money"
"datafromravens",1,1,"28",28,"low paying field making well average"
"Weekly-Dig-9516",3,3,"28_1",28,"work new rds getting pay many working years longer view  paid less "
"datafromravens",1,1,"28_1_1",28,"unique rds common many fields raises really cost living adjustments apply everyone"
"Weekly-Dig-9516",1,1,"28_1_1_1",28,"agree everywhere pay still lower masters degree taking management duties "
"Weekly-Dig-9516",1,1,"28_1_2",28,"also getting paid less new graduates matter degree something wrong "
"phonetic_luck",1,1,"28_2",28,"true everywhere area many general retail fast food jobs make sometimes jobs"
"datafromravens",1,1,"28_2_1",28,"wic maybe experience entry level  imagine rds making minimum wage average love learn location "
"phonetic_luck",2,2,"28_2_1_1",28,"mcol midwest area jobs posted wage range per hour though seen even low though obviously left open months lol lot companies open negotiate know fact current company ltc told recent applicant unwilling negotiate offered lower end range comapny also denying coworkers even worked years annual raises main reason multiple coworkers left past several years meanwhile  hiring cooks hour buildings fsds make imo paid well also paid appropriately say  positions pay well area just diamond ruff competitive hoping dietitian shortage new requirement wages start rise companies struggling fill positions lower pay ranges"
"TraditionalAd5409",1,1,"28_2_1_1_1",28,"wow sorry hear never heard wages low"
"[deleted]",1,1,"1",1,"removed"
"Turbulent_Spend_6480",1,1,"1_1",1,"rampd one interests amp masters bachelors  dpd program  masters nutrition science really wish able food sciencerelated masters will look flavorist jobs never thought"
"meggsnbutter",1,1,"2",2," many suggestions since still internship culinary medicine might area interest  worked couple teaching kitchens  definitely able combine love cooking educating creative recipes  ask study abroad experience italy france interested farm table eating nutrition programs  know many programs near experience part nutrition program something able explore"
"Turbulent_Spend_6480",1,1,"2_1",2,"will look love work teaching kitchen weird thing one city amp part one universities assume open public weird definitely need public teaching kitchen community will research went italy specifically tuscany sansepolcro amp florence part program done enrichment rotation rewarding experience amp truly think every single day know travel ceu opportunities around part group sure besides taking individual selfstudy trip feel free"
"[deleted]",1,1,"1",1,"deleted"
"IdaLi27",1,1,"1_1",1,"good know thank worried working weekends"
"oneblackdog1976",2,2,"1",1,"believe anfp iowa lot cdms use martin brothers website webinars"
"AllFoodsFit70",12,12,"1",1,"data showing team saved hospital money either appropriate transitioning parenteral enteral decreasing length stay complications fewer infections  money talks big wigs insurance companies including medicare  necessarily going reimburse system everything patient ended needing stay"
"Hour-Technician-6787",12,12,"2",2,"start collecting examples times shitty job orders demonstrate redone correctly rds ultimately wasting money paying providers incorrectly just making extra work everyone causing harm ethical issue hands frustrating position feel"
"Puzzleheaded-Test572",5,5,"3",3,"admin wont care see thats matters dietitian nutrition support team makes sense means present research cmo use aspen espen find papers jama surgical journals might good resources"
"fat_louie_58",3,3,"4",4,"work level nicu rds using zscore change document mild moderate severe malnutrition nutrition plan agrees diagnosis add malnutrition problem list nutrition section note copy recommendations liberty discuss amount revenue number better zero"
"vitallyorganous",9,9,"1",1,"peng guidance specific recommendation cancer high bmi next best peng recommendation someone bmigtkg actual bodyweight egfr may aki ckd amp aki resolved wouldnt restrict protein least initially markers renal struggle next review renal electrolyte derangements rise getting cancer amp treatment important delaying time dialysis protein guidance setting useful"
"plzdontbetaken66",2,2,"1_1",1,"thank comment peng stand"
"vitallyorganous",1,1,"1_1_1",1,"bda british dietetic association parenteral enteral nutrition group publish dietitian mini bible dietetic practice guidance every years rooting around espen guidelines figured guidelines also relevant feed eachother"
"No_Salary_745",3,3,"2",2,"protein needs adjusted obesity suggest using per height approximate target esp higher pro needs"
"izzy_americana",3,3,"3",3,"patient  new creatine gfr gfr  gfr stage range  little bit lower"
"vitallyorganous",2,2,"3_1",3,"adjust actual versus adjusted ideal body weight bmi something example almost protein day lot mass contributing obesity going relevant protein demand"
"izzy_americana",1,1,"3_1_1",3," use abw"
"AutoModerator",1,1,"1",1,"title indicates may student looking advice may interested crossposting rdb subreddit current future dietetic students interns share dieteticsrelated information support bot action performed automatically please contact moderators subreddit message compose dietetics questions concerns"
"[deleted]",1,1,"2",2,"deleted"
"Mallood",1,1,"2_1",2,"thank"
"Commercial_Tap5167",1,1,"3",3,"used work ltc used wear lot hats solving many problems nothing nutrition went outpatient lot different took cdces exam think text book answer technically help person hope makes sense"
"Mallood",1,1,"3_1",3,"thank advice resources use"
"Commercial_Tap5167",1,1,"3_1_1",3,"used beverly course material aade  adces"
"selene521",9,9,"1",1,"check regulating body canada allowed use rdb just dietetics student bios"
"Repulsive_Doughnut40",2,2,"1_1",1," apply listing credential rdb aspiring future  descriptors lot social media bios  never seen listed credential jane doe rdb obviously nono hopefully people  lol anyway just  imagine easy way govern people list bio totally wrong"
"selene521",3,3,"1_1_1",1,"college dietitians sees using combo including rdb presenting registered dietitian since protected title ontario  fine someone pretty seriously using modified title  using title provide present nutrition education via social media  differentiate saying jane smith rdb jane smith mom wife leafs fan rdb suspect pursue fine got complaint someone sharing misinformation going beyond scope general nutrition education school emphatic"
"Repulsive_Doughnut40",1,1,"1_1_1_1",1,"ohhh see  think like makes sense future dietitian since  thank explaining"
"rjo755",4,4,"2",2,"knowledge allowed states terms interchangeable used rdb instagram became dietitian"
"MidnightSlinks",4,4,"2_1",2,"told school allowed misuse cdr owns restricts use title related dietetics dietitians"
"rjo755",2,2,"2_1_1",2," specifically called cdr allowed use eligible rde called used businesses access dietetics universities promoting courses degrees students seeking become dietitian point  seen cdr academy allowed"
"MidnightSlinks",1,1,"2_1_1_1",2,"just told school cdr   students use anything related maybe just cautious misunderstood since cdr  list  right fine evidence use  evidence acceptability since people also still use eligible despite forbidden"
"rjo755",2,2,"2_1_1_1_1",2,"agree  guess likely legal issues companies using marketing social media weren allowed"
"MidnightSlinks",1,1,"2_1_1_1_1_1",2,"shocked many companies commit small legal violations like social media marketing materials  recall specifics post like year ago pointing problems employee profiles one telehealth companies like saying people licensed states  offer licensure listed cde credential cdces longer telehealth company existed also actually sure trademark violation company say social media recruiting eligible people listing employee rde credential behind name company profile page violation generic usage likely  illegal first amendment even remedy cdr pay law firm submit cease desist letter every single person company sue anyone  take academy budget lol basically honor system"
"rjo755",1,1,"2_1_1_1_1_1_1",2,"academy lawyers large dietetics related companies using rdb  want used least list improper use cdr site find instagram post dpg using term though interesting indicative violations like mentioned really  surprise amount job listings  seen still refer american dietetics association"
"MidnightSlinks",1,1,"2_1_1_1_1_1_1_1",2,"definitely money sue anyone lol new ceo laid like staff year ago rip  look public irs filings see none top compensated employees lawyers means firm retainer charge breathe inhouse counsel best cdr staff person sending usage guide pretty please last point still see literal laws regulations using old name new proposed bills regs just old stuff work health policy see time die little inside never trust large language model trained open internet"
"AutoModerator",1,1,"3",3,"title indicates may student looking advice may interested crossposting rdb subreddit current future dietetic students interns share dieteticsrelated information support bot action performed automatically please contact moderators subreddit message compose dietetics questions concerns"
"heartskipsabeet",3,3,"1",1,"seen done dietitians speciality areas hard hire example pediatric dietitian small city amenities rural location internships nearby dietitians area possibly  either need specialty training willing live less desirable area struggling hire"
"nonamegal_",1,1,"1_1",1,"also one thing read may ask crazy place considered less desirable like chaotic just pay lower compare areas"
"heartskipsabeet",4,4,"1_1_1",1,"well  necessarily crazy pay poorly less desirable job middle nowhere small town limited shopping restaurants cultural amenities far larger cities towns"
"nonamegal_",1,1,"1_1_1_1",1," bad still tolerable thank"
"lush_rational",2,2,"2",2,"coworker first job years ago internship hired already hbs little different nonprofits lot hospitals  subject cap forprofit companies lot problems got new job  bother ask sponsor took bit back forth end sponsoring based posts still seems lot competition jobs may hard find somewhere willing sponsor unless certain expertise"
"nonamegal_",1,1,"2_1",2,"damn  know hbs also different different type employers judging base current state dietetics think easier  hired dietetic internship  make much difference sorry know  make informed decision one searching web feel like better ask someone already dietetic field"
"[deleted]",2,2,"3",3,"deleted"
"nonamegal_",1,1,"3_1",3," mind asking country city honestly picky institution long  work patients hearing able transition nursing home renal large city picked bit since already second thoughts taking exam"
"Valuable-Trouble-538",2,2,"4",4,"friend mine got hired working renal outpatient based"
"nonamegal_",1,1,"4_1",4,"wow thought list  great news"
"Valuable-Trouble-538",2,2,"4_1_1",4,"malaysia went university buffalo sometimes really luck sooner eventually east specific"
"nonamegal_",1,1,"4_1_1_1",4,"nice yea feel like luck will also play huge role malaysia applied already"
"Express-Character643",1,1,"5",5,"direct hire asia  working dietitian visa"
"MidnightSlinks",2,2,"1",1,"sure rights often work hire employees property employing company unless specifically negotiated otherwise actually concerned old employer may presentations unless recreate presentations scratch extracurricular produced time using computer"
"fireflystare1504",1,1,"1_1",1,"lot leeway offer different types workshops  agreement received sales presentations put staff mine logo  use always used personal websites previous employer website"
"Ambitious-Session157",37,37,"1",1,"disclose leadership conflict interest may discuss options approach plan care"
"mwb213",13,13,"2",2,"like another redditor mentioned disclose concerns authority figure like  administrator document conversation followup email resident already history acting staff bring concerns especially risk making false allegations something outside thing owe clinical treatment provided professional ethical manner  owe anything personal basis  like long remain professional  even really fake nice given history  friendly  talk anything unrelated position entails rapportbuilding typically helpful sometimes just feasible speaking starts act remember  always end conversation something like feel conversation longer clinically productive ending conversation  leaving room thank time just walk documentation might indicate interview ended early account agitated aggressive making inappropriate remarks whatever else might apply"
"Aimeeboz",3,3,"2_1",2,"told everyone authority administrator  kitchen manager shared apprehension experience told story bullying back share awkward girl high wanted nickname wanted called bubbles mean girl gave another nickname followed poor awkward girl dubbed tuna rest adolescence  take well plus flashed boyfriend early shocked sure process told mom gave sage advice  seems callous given situation  excellent rapport everyone closely work building told story definitely know worth neither  administrator surprised past behaviors"
"dumbchickpea",6,6,"3",3,"omg soo uncomfortable course treat like patient nonbias obviously hard leave behind personal feelings deserves treatment resident snaps thats goes gentle acknowledge know eachother just  know want help might like see familiar face"
"Frosty_Molasses_1141",4,4,"4",4,"sometimes imagine situation glad hasn happened yet say always ask another person room guise something else witness conversation nervous think front great maybe something along lines  since last time saw gone school become dietitian work  making sure residents receive food nutrition best meets needs today talk xyz  know whole situation maybe know going school dietitian maybe good rough draft  started organizing thoughts"
"Educational_Tea_7571",5,5,"4_1",4,"yes ask social services adon whomever giving brief explanation knew person past relevant background just said guidance    responsible stuff people professional sweat one resident building knew years ago lots just job "
"[deleted]",2,2,"5",5,"deleted"
"Aimeeboz",3,3,"5_1",5,"guess overestimated status lol recognize talked managed establish rapport colleague tasked page minutes speak room case ability break convo looked rough voices sounded like may cva one point reason personally identify someone used know far concerned just dietitian apprehension"
"MidnightSlinks",2,2,"1",1,"usually noncompetes types platforms forbid working offline clients obtain  want using free marketing agency absconding clients huge cut insurance payment business model depends consistently getting big chunk reimbursements services platform"
"No_Honeydew_1309",1,1,"1_1",1,"long keep clients one company transfer okay"
"MidnightSlinks",1,1,"1_1_1",1,"contact ask sign  answer definitively"
"peckish_peanut",1,1,"2",2,"ever find especially wondering thing  berry street pay reduction thinking switching nourish "
"kbmciver",19,19,"1",1,"maybe look data specialist roles food service one enters ingredients recipes  menu management software"
"No_Honeydew_1309",7,7,"1_1",1,"okay know find type role appreciate"
"kbmciver",6,6,"1_1_1",1,"start universities hospitals know places menu management programs maybe research customers netmenu cbord"
"Merpin-n-derpin",3,3,"1_1_1_1",1,"school districts always need type help even got done bachelors really wanted official hope pay credentials"
"PositiveOk178",8,8,"2",2,"contract employee telehealth company like nourish example"
"SaladsAreYuck",8,8,"3",3,"found wic low stress since covid local program hybrid"
"MuchPerspective8234",1,1,"3_1",3,"state  mind asking wic clinics area person"
"ReticentBee806",2,2,"3_1_1",3,"depends agency really biggest wic agency country services county still everything remotely least presence waivers end next year agency small chronically understaffed never stopped working person"
"Alive-Future-7789",5,5,"4",4,"look companies telehealth health coaching work company hires health coaches many required position  pay great low stress flexible"
"Dependent_Toe_2055",5,5,"5",5,"may specific program bariatrics low stress lot time office work facing days see patients days  short phone visits none will occasionally busier day visits lot heavier housekeeping insurance stuff though"
"Fragrant_Wait_8947",1,1,"5_1",5,"say every bariatric program like lucky outpatient bariatric dietitian years seeing patients daily overwhelmed stressed absolutely hated fortunate see"
"Dependent_Toe_2055",1,1,"5_1_1",5,"gosh sounds terrible  ask visits mine mainly new evals month post ops requests see also short inpatient visits program great monthly nutrition visits classes teach pts via microsoft teams month seeing one one"
"Fragrant_Wait_8947",1,1,"5_1_1_1",5,"mix initials pre post madness used groups took patients like"
"TerribleCrew2927",2,2,"6",6,"work foodsmart telehealth dietitian think great job like low stress work remotely think pay bad obviously good site jobs job"
"[deleted]",1,1,"6_1",6,"never knew existed tbh"
"Fragrant_Wait_8947",1,1,"6_2",6,"work full time employee"
"TerribleCrew2927",1,1,"6_3",6,"yes"
