"author","score","upvotes","comment_id","thread","Cleaned_Comment"
"Ordinary_Lobster_764",1,1,"1_2_1_1",1,"yeah think going bigger project first thought correct vincent grenadines based use premade sterile feeds standard totally different world apologies say menus mean literal menus chicken peas dietary values provided want develop  assess exactly giving patients terms nutritional provision also believe dietitians provide estimated kcal protein based calculations doctors choose foods meals given rate volume though assuming bolus unless decanting blended liquidated foods using pumps unlikely yet find"
"Bwrw_glaw",3,3,"2",2,"hospital work several standard blended feeds make kitchen nutrient analysis software rds access micronutrient data recipe  assess patient needs vitamin supplementation addition generally admitted patient will single blended recipe admission though longer admission family desires may opt vary recipe throughout stay patients home longterm blended tube feeds always micronutrient analysis recipe using single recipe encouraging variation fruits vegetables grains proteins  used ensure overall balanced diet currently picking blended recipe sticking one entire admission mixing matching already recipes oral eating menu just blended different know meals providing orally fed patients nutritionally complete actually encourage rds think plate model making breakfast lunch dinner patient balanced serve blend long reasonable variety  cause concern oral eater long meeting macro needs accounting medical diet needs good nutrients often difficult meet blended feeds include sodium least hospitals try hard make everything low sodium vitamin easy vitamin high carrots orange squash easy blend resources may helpful marsha dunn klein homemade blended formula handbook recipe building templates various kcal amounts tables foods high nutrients recently published aspen blenderized tube feeding practice recommendations  access support line also article years back implementing blended tube feeding clinical setting may helpful"
"PuggBut",2,2,"3",3,"sure will helpful use nestle medical hubs blenderized tube feed calculator outpatient setting"
"AutoModerator",1,1,"4",4,"title indicates post may nutrition support may interested crossposting nutritionsupport new subreddit devoted entirely nutrition support bot action performed automatically please contact moderators subreddit message compose dietetics questions concerns"
"eat_vegetables",2,2,"1",1,"great experience nutritional science via oklahoma state gpidea consortium  already practicing dietitian program provide requisites internship"
"Pristine-Mousse-2147",2,2,"2",2,"online undergrad dietetics kansas state university plan online masters well complaints"
"feraljoy14",1,1,"3",3,"like joint masters dietetic internship"
"veganTNT",1,1,"1",1,"think just signature front accepted"
"ithinkinpink93",1,1,"2",2,"signature anywhere fine"
"StrawberryLovers8795",34,34,"1",1,"may think patients need lose weight old order set just automatically populated just come information stress factors eras protocols show patient will unique needs based multitude factors kindly take order set also explain nutrition needs immediately surgery may different maintenance diet patient needs home"
"Coachk135_",13,13,"2",2,"just feels wrong many patients risk malnutrition postsurgery  think reason hospital cho per meal mainly track proper insulin dosing  really decrease food options sometimes  even cardiac diets postcabg also share products like impact advance recovery several metaanalyses rcts showing great benefit infection risk reduction greater wound healing shorter los"
"hooperbee",5,5,"3",3,"agree one also small hospital worked surgeon passionate nutrition always demanded high fiber extra servings protein processed carbs pts cabg literally reach personally ate fruit cup cheerios demanding removed name controlling hyperglycemia trying  patients insulin drip fast humanly possible seem understand care serving year old steak potato man tummy ache quinoa tuna salad apple lunch serving anything many hungry patients wasted salads plenty facilities flexible sure start fluid diet consistent carb meal diabetic generally will end around kcal  add snacks shakes increase carbs per meal remove restrictions individual basis think icu surgeons accepted surgery pts will need spend time insulin drip just  patient eat wait till post inflammation chills insulin requirements come baseline rehab"
"Lopsided-Rhubarb6072",4,4,"4",4,"likely reduce control blood sugars  realize reducing calories well post cabg big push surgeons offer juven ensure max protein even required  fill form asking offered juven"
"Nutrition_fun",2,2,"4_1",4,"specifically stated diet order although  caloric restriction diet order comments kcal confused"
"Lopsided-Rhubarb6072",3,3,"4_1_1",4,"surgeons job confuse surgery teams always worst many old school hospitals diets written ada ada ada many mds will leave ada part especially cardiac surgeries wanna keep calculate needs feel need increase calories make sure getting enough protein matter especially cabg many surgeons will also post diet low carb writing privileges just change diet juven ensure max protein thing told cardiac surgeon one day sudden getting consults stating add juven ensure max abbott good getting products check list"
"Ancient_Winter",3,3,"5",5,"setting meeting team good idea guess done patients precluding entry error like old diet following someone else mentioned might due evidence calorie restriction may protective ischemiareperfusion injury limited reading though usually done restriction days prior surgery sure seen clinical trials restriction surgery  say  looked hard"
"Nutrition_fun",1,1,"5_1",5,"oooh tell doi like read"
"Ancient_Winter",0,0,"5_1_1",5,"review years old going ischemiareperfusion injury knowledge time review bit recent focused ischemia reperfusion injury broadly related calorie restriction tissue function heart"
"Nutrition_fun",1,1,"5_1_1_1",5,"thank"
"Ancient_Winter",1,1,"5_1_1_1_1",5,"find anything meeting cardiology restriction practice curious said"
"Nutrition_fun",1,1,"5_1_1_1_1_1",5,"yes eventually found referring old ada recommendation wanted goals glucose control team agreed come across attending ick things like baked potato chips hint salt carbohydrates patient already carb consistent diet tracking carbs literally photo sent today via chat patient potato chips room also started venting wholegrain breads refined grains course dismissed knew opening another  worms yays icks"
"jaw80",1,1,"6",6,"calories"
"Nutrition_fun",1,1,"6_1",6,"thats said"
"jaw80",1,1,"6_1_1",6,"crazy idea gotten idea"
"Vexed_Violet",1,1,"7",7,"patient supposed heal less protein calories"
"tater_pip",1,1,"8",8,"run indirect calorimetry vented patients ree just okay"
"voxene",1,1,"9",9,"cts provider  restrict calories actually encourage eating much possible whenever  eat patients often struggle nausea vomiting post routinely tell patients eat whatever want mindful diabetics  cho restrictions sugars start insulin drip  fluid restrictions trend weights iampo closely titrate diuretics needed maintain negative fluid balances"
"Nutrition_fun",1,1,"9_1",9,"thank much comment understand provider recommend just wondering recommendations came first ones indicate"
"MidnightSlinks",0,0,"1",1,"website expected hourly wage mean hourly wage predicted worksheet multiple regression model model estimates based data current january hourly wage includes regular salary wage paid position excludes earnings work overtime pay oncall premiums commissions bonuses incentive pay profit sharing retirement benefits received monetary value benefits expected annual salary expected hourly wage annualized hours per week weeks per year"
"Medical_Sherbert5149",1,1,"1_1",1,"thanks see understand included hourly predicted wage still clear whether based positions often bring benefits"
"galaxyofcoffee",1,1,"1_1_1",1," answer question according calculator people making pennies tell people role amp location estimates"
"[deleted]",2,2,"1",1,"sure mean find wording sounds like words input job search sites like indeed linkedin case want simply enter remote dietitian make sure location section blank set remote  telehealth nutrition counseling companies remote article different ones "
"Tman78910",1,1,"1_1",1,"yeah appreciate link guess remote work  difficult find  seems though difficult find jobs nutrition sales type indeed kinds things pop lol"
"[deleted]",4,4,"1_1_1",1,"directly company sites see openings like abbott nestle kate farms whoever makes liquid hope   also  linkedin  already optimize profile add  looking kind work resume highlight key words relevant sales role like communications customer service patients customers    d also connect people work companies linkedin company page people select titles like recruiter manager director supervisor never send invitations greeting  know want connect interest sales good luck "
"Different-Smile-2166",5,5,"1",1,"say even  know answer questions  always know answer practice knowing locate answer resources turn equally important  afraid use answers think also important note often right wrong answers lot situations case studies use clinical judgement stage will rely lot knowing resources seek phone friend good luck"
"NutritionBro",4,4,"2",2,"jhu alum congrats getting interview advice  caught technical questions stay true know mention resources turn stuff   shine  show  professional discuss prior work experience  strike balance confident humble good luck"
"Trick-Loss3551",3,3,"3",3,"thanks everyone happy share interview went really well mnt pretty basic clear really just wanted see thought process working conditions hoping hear back soon"
"shakriv",2,2,"4",4,"mnt part  just calculating bmi kcals memorized calcs interview hopkins crazy good job mnt know  still learning just looking critical thinking gave scenario cancer patient remember saying verbatim  covered class yet   need protein blah blah"
"cuteshrimp",10,10,"1",1,"purposefully left outpatient  want deal admin associated"
"NoDrama3756",15,15,"2",2,"potential make money always  mean pleasure time come ahead example know started corp goes around contracting jails mnt menu approval education counseling  given rates many facilities makes year say many times beginning  think business model work starting business drain personal finances also startup overhead example starting llc corp  cost hundred dollars buddies started one pay cpa external accounting service books  best know tax loopholes year yes taxed lower rate still pay taxes withdraw business potential work"
"FullTorsoApparition",5,5,"3",3,"paper  make lot also charge retirement finances health insurance   paid days  seeing clients much nonclient facing time will spent administrative work people normal job answering voicemail checking email sending insurance claims balancing books  also need pay overhead like charting software office space  something seriously considered times uncertainty  suit well time value personal time private practice still need another job income beginning working beginning potentially less compensation  work years establish good client base seems  easier satisfaction often good takes certain mentality work ethic "
"Due_Description_1568",2,2,"3_1",3,"agree wrote think lot depends important benefits besides direct income state employee  paid decently plus employer contributions towards health insurance retirement match well paid time sick leave things give lot security able miss work young kids sick elderly parent needs think sometime line may want switch gears work fewer hours  benefit keeping pay benefits even miss work really important sure people work way plan around setting aside money missed work  think remember learning back day food service management class indirect costs employers like overall salary something"
"karinacocina",5,5,"4",4,"also consider benefits lost current job match pto health insurance stability  speak much make losing benefits kept pursuing private practice"
"Phillyphan19147",3,3,"4_1",4,"true also want consider  set solo private practice addition  save  save income pretax"
"money-please",1,1,"4_2",4,"definitely hard losing starting practice financially strained first enough clients match previous salary worth though "
"Selfdiscoverymode_on",4,4,"5",5,"understanding lot leg work involved  started think depends want accept insurance  accept insurance   need better marketing pay someone help regard  set rates accept insurance may easier  clients limited insurance pays   seen insurance based practices claim still reimbursement dietitian good video breaking income potential based hours week though others mentioned will overhead worry less benefits overall definitely think potential just match full time salary personally working private practice startup start fulltime inpatient position next week  "
"ZealousidealCarob540",4,4,"6",6,"works well traditionally also bread winner family contract work took time set business costs year maybe little less hippa liability insurance llc paying ceu save pay taxes goes roth ira work full time currently work school hours typically days week  typically  admin done made hospital jobs near making work clinic hospital hours worth back person  work regularly eat yummy healthy food home dog present kids home school currently trying build  contracts increase pay love make money also know good time freedom admin billing minimal use hippa compliant tool transcribes notes cons always charge pay rate reliant referral sources little burnt"
"kaltech14",2,2,"6_1",6,"take insurance"
"ZealousidealCarob540",1,1,"6_1_1",6,"contract counties via state  rate per unit contact local early intervention program although will say several contractors recently applied freaked peds training competent clinical community based peds serves developmentally delayed disability community see lot infants nicu oxygen rare genetic conditions enteral feeds arfid sensory processing differences syndrome asd many issues"
"kaltech14",1,1,"6_1_1_1",6,"thanks"
"peachnkeen519",2,2,"7",7,"private practice always recommend common insurance policies covers mnt wealthier population base  private pay also consider overhead office space emr  set private practice working full time hospital job started getting enough patients quit full time job private practice full time honestly  know many poo poo  know people tried speaking experience pregnant kids born went part time really good lifestyle start time investment beginning lot yes def worth think major difference found mine worth home visits exclusively office physical overhead rent also networked docs steady stream referrals also cdces always patients needing services independence flexibility really best recommend lol"
"Jolly-Ad9580",1,1,"7_1",7,"great  positive experience think ever back work outside"
"peachnkeen519",1,1,"7_1_1",7,"actually already moved across country managing practice televisits contract rds became much since also managing house rental sold eventually years state closed llc new state moved different policies insurance carriers  experience policies city also affluent every private practice saw cash pay different kind nutrition focus used looking jobs found one industry working smaller company direct patient care  msl smaller formula company ever back clinical practice hospital outpatient clinic  back private practice possibly yes timing right"
"cowgirldreams",1,1,"7_2",7,"noticed  cdces comment interested pursuing eligible sit cdces exam deep passion diabetes curious think worth getting since said always clients help lol financially billing work still bill mnt services cdces trying see roi since planning just practice"
"peachnkeen519",2,2,"7_2_1",7," personal experience billing dsme taught outpatient hospital dsme classes billing dept  look overly complicated though since  many cpt codes  know current reimbursement either sure  find finding cms reimbursement rates cdces credential imo really credibility marketing providers  referral stream although will say want teach specific dsme payer cover mnt way provide  just alone noticed straight medicaid often way states practiced sure beyond lived states depending state cdces may allow insulin adjustments think also although hot minute since closed practice  know changed private practice always billed mnt cpt codes since always talk nutrition every visit billing  difficult since everything electronic just patience figure processes major payers area diabetes management bill dsme codes hope answers questions"
"DimensionEconomy6647",1,1,"8",8,"one online platforms depends client sourced overall need volume generate substantial pay  replace likewise contracts depends negotiated rate stress always though comes billing hippa compliance solo"
"DietitianE",1,1,"9",9,"going depend talk coworker went private practice always worked part time clinical never made enough leave questioned whether worth hard time getting steady stream patients individual answer people practice decades  want way"
"rebeccafromla",1,1,"10",10,"cost see  great benefits clinical job including pension health care entire family four weeks vacation sick time per year education days food voucher monthly stipend take public transportation"
"[deleted]",1,1,"11",11,"answers will vary  met rd  done decades thrive say worth others right back job several years  still rds feel done burned bored seeing patients lessen stop hire help focus ways grow business like offering courses clients coaching rds monetizing blog getting communications like media appearances sponsorships writing  many factors consider comes pay niche market demand cash insurance virtual inperson facebook group dietitians private practice good place ask"
"avilleHR",1,1,"12",12,"likely looking cut pay also  benefits job able deal inevitable dips business market  support business"
"Jolly-Ad9580",1,1,"12_1",12,"concern inevitable dips business unreliability  benefits husband  issue"
"Feeling-Egg-3772",1,1,"1",1,"received interview invite morning acceptance decisions  set come march"
"Visual-Loss2379",1,1,"1_1",1,"program  mph nutrition dietetics"
"Feeling-Egg-3772",1,1,"1_1_1",1,"yes mph nutrition dietetics"
"Potential-Session697",1,1,"1_2",1," interviews dietetics program"
"Feeling-Egg-3772",1,1,"1_2_1",1,"held mandatory information session lieu traditional interviews year weren evaluated"
"Potential-Session697",1,1,"1_2_1_1",1," receive interview invite portal jus says application submitted sure competitive enough"
"lush_rational",30,30,"1",1,"good practice general ask someone preferred name call form fill include spot preferred name"
"Fair_Onion_1289",9,9,"2",2,"yes intake forms specifically ask legal name preferred name take insurance need use legal name bill ehr keeps preferred name profile visible"
"birdtummy717",4,4,"3",3,"usually ask people want called say please call good starting spot"
"Due_Description_1568",5,5,"4",4,"yes ask name pronouns use already emr confirm verbally tip just  used every time  also confirm prefer addressed time"
"Gingertitian",1,1,"5",5,"yes yes yes anything make patient feel heard seen recognized will strengthen connection"
"money-please",9,9,"1",1,"latest gimmick general population  marketing know normal glucose spikes root disease sales luckily   keep eye health using devices live fingertips  overall lifestyle direction lots misinformation demonizing glucose spikes excessively incorrectly less direction test insulin sensitivity test regular physicals provided "
"[deleted]",1,1,"1_1",1,"deleted"
"money-please",1,1,"1_1_1",1,"  wrong great tool sure majority nondiabetics transforming live mostly means obsessing demonizing glucose spikes expensive inappropriate general use  diagnosis happen use see trends suggesting diabetes likely caught regular check ups  diabetic patients using cgm end questions confusion good bad "
"Tiredloafofbread",5,5,"2",2,"great way make people freak normal post prandial glucose spikes also sounds like great option anyone lives eating disorder strong sarcasm"
"[deleted]",0,0,"2_1",2,"deleted"
"Tiredloafofbread",3,3,"2_1_1",2,"sorry long comment incoming think marketing product like large demographic people  need rubs wrong way course people going benefit  ethical create product like targeted people  diabetes prediabetes think company created product empower people think capitalizing trend course gain insightful information patient came used work alongside talk goals  demonizing obviously good practitioner  agree ethics pricey product well likely affordable small percentage people  see wellness influencers using creating content general public thus fuelling fear mongering content general public using cgm funsies understand eating pattern impacts sure using long term  diabetes also concerning majority people  understand blood sugar supposed rise fall lot people use might feel needs flat possible true"
"[deleted]",1,1,"2_1_1_1",2,"deleted"
"Tiredloafofbread",1,1,"2_1_1_1_1",2,"honestly  think pov wrong also  think mine either  see appealing  helpful personally  agree product using product bad per  recommend someone unless needed nice clinical indication use imo general public glad like using cgm empowers"
"Noobender19",3,3,"3",3,"seeing believing role demonize people seeking information guide"
"MidnightSlinks",4,4,"4",4,"think seeing post prandial spike cgm  help someone prediabetes take nutrition exercise advice seriously help someone high insulin sensitivity stop worrying much macro composition every single bite take weeks one box cgm  powerful tool especially patients seeing rds  interpret readings medicare also  cover prescription cgms unless people using insulin hypoglycemic events think also place use people type insulin yet help understand status better annual reading family member taking diabetes seriously aside taking metformin daily actually insisting still prediabetes diabetes despite slapping cgm weeks seeing stay straight hours family gathering running primary care doc asking next level treatment"
"JustARedditBrowser",3,3,"5",5,"dietitian type diabetes uses cgm just  see  going almost entirely scam general population will mostly see normal blood sugars maybe occasional bit higher response eating candy fat content drinking soda okay cool stop guess conventional advice already covers expensive way  health data will pretty useless people think might catch people pre diabetes diabetes doctor well doctors screening regularly enough risk factors likely less expensive less time intensive way discover"
"[deleted]",1,1,"5_1",5,"deleted"
"JustARedditBrowser",1,1,"5_1_1",5,"response  also see results feel free people want use device fine want pay see happens ahead think  guidance results mean ability take action may misinformed difficult mentioned another comment ate pancakes felt tired saw spiked argument already know pancakes lead feeling tired knowing high blood sugar may reason going huge additional motivator maybe lot people ultimate position cgms general population mostly gimmick someone asked  one  medical need recommend save money said working someone really wanted afford course incorporate data part discussions goals want nutritionally  field long enough know harming someone just kind things build rapport worry wellness industry taking advantage people convincing  biohack life supplements food products control blood sugar mostly snake oil"
"veganTNT",9,9,"1",1,"use touchcalc site calculates bmi like bka aka"
"doggiemommiee",3,3,"2",2,"knee knee entire leg arm cdr"
"CharliDreamer",7,7,"1",1,"live well  never personally worked  never heard anything good close friend worked past years usually just goes jobs needs  hours  check something better opens said work death interviewed benefits great pto important  give days pto  worked year company worked gives weeks per year grows longer work company love current company work   years  work ltc company provides services well dietetics field"
"Aggravating_Court_40",3,3,"2",2,"beware company discussed group just search will see lots experiences"
"euphoria700",1,1,"2_1",2,"reviews soo mixed seems like experiences different sites vary"
"Aggravating_Court_40",4,4,"2_1_1",2,"want overall view area   time til year  little training will likely  asked cover different places dietitians likely sight unseen raises barely happen like used manage dietitians budget save money keeping rds happy revolving door left make money  managing noone managing rds also just unethical penny pinchers take negative reviews seriously read reviews indeed embarrassing tell people worked terrible reputation unfortunately took nursing home company worked almost years contracted dept never chosen work already knew prior long gone  please careful also health insurance unaffordable reason always seeing openings"
"meep0226",4,4,"3",3,"think depends lot people said beware shared bad experience personally paid well managers great facility employees friendly job genuinely fun"
"Apprehensive-Bag7222",2,2,"4",4,"pretty good experience flexible schedule negotiated  week pto  start using days"
"Creative_Seashell",2,2,"4_1",4,"yes new england great leadership"
"Strict_Total_4703",1,1,"4_2",4,"living ohio mit hcsg just quit spur moment today worst company ever"
"liveluuvreddit",2,2,"5",5,"enjoyed time working thought pay fair times managing multiple facilities challenging super flexible schedule truly weekends unless wanted work weekend  bothered ever done work"
"NoDrama3756",2,2,"6",6,"enjoyed time company pays well potential upward mobility reimbursement travel proffesional expenses "
"euphoria700",1,1,"6_1",6,"mind asking located feel free"
"NoDrama3756",1,1,"6_1_1",6,"rural south"
