"author","score","upvotes","comment_id","thread","Cleaned_Comment"
"Silver-Parfait-2121",1,1,"42_1",42,"fiancé going something like treated poorly preceptor program  side support given ultimatum redo hours withdraw program advocated hard matter says proof brings forward  change decision even helped comb universities acend policy pointed literally breaking policies still  care forcing repay course  help find new preceptor spent thousands traveling site worked hour days  hours done save money awful  sure"
"Confident-Angle-2026",1,1,"43",43,"preceptor month undergrad internship horrible told end  ready dietitian mind even started grad school time yeah  ready  supposed"
"Interesting-Fig1777",1,1,"44",44,"thing happened months ago end program nothing great evaluations point none low scores even something based skill shit like understanding team dynamics despite site like weeks like program director  blindly side preceptor given scored well previously tell super important advocate know great work really sucks great experiences preceptors last site  winners guess"
"Bitter_Evening_712",1,1,"45",45,"worst preceptor nicu unapproachable rude extremely stuckup never really showed anything everytime ask question stated like obvious absolutely hated glad spent short time though preceptors location nice though except"
"Silver-Parfait-2121",1,1,"46",46,"fiancé currently dealing program completely sided preceptor even though provided documentation completed competency rude bad literally made count hundreds condiment packets just preceptor nice either never told  meeting expectations supposed know change learn never told even told good job left gave horrible eval program  forcing redo hours pay course fed never seen poor treatment academia ever amp  sure anymore tried dispute advocate much possible even shared concerns preceptor bias mistreatment programs responses basically big  care feel  really take  said consideration"
"ninehas4letters",2,2,"46_1",46,"damn thats pretty whack sucks cause interns low totem pole reach program director head whoever charge department plea case since program  cheap  sound like giving fair trial tell hang"
"Silver-Parfait-2121",1,1,"46_1_1",46,"tried  helped try navigate situation  standing ground  said next step reach dean think  result just submitted formal complaint acend morning amp really hoping something completely deterred profession considering leaving something else"
"ashlyncara09",1,1,"47",47,"broke crying one time preceptor week different one every week clinical later week weekly meeting cnm told unprofessional cry work going medical issues time things  say overall enjoy clinical rotation taught treat interns"
"pollyatomic",3,3,"1",1," help got curious looked listings indeed disappointed see salary range mental health therapists significantly higher dietitians given educational requirements responsibilities quite similar rds given higher caseloads patients dietitians therapists interviewing might express concern easy say since private practice looking job  worked yet  marketing networking stuff time might reach  know salary discrepancy sends messages dietitians less valuable skilled facilities sometimes willing listen outpatient providers since often ones sending patients best convince pay dietitians good luck end working love hear like"
"BootSuspicious5153",3,3,"1_1",1,"therapists also case managers ur groups top caseloads  paid hloc case management top duties  envy wish someone take case management away lol takes much time may also see clients often  equip rd just individual sessions meetings said hiring blitz right  friends rd peer mentors equip hiring providers  july lowered salary range rd therapists blitz  friends love years low turnover rd big yearly performance bonuses "
"Sea-Extent5634",1,1,"1_1_1",1,"interesting hiring blitz right  friends peer mentors extensive backgrounds even background mental health young adult trying  foot door peer mentor just applied cst pst est time zoned positions wondering  difficult anticipate bachelors degree health related area experience patients mental health setting curious knowledge"
"BootSuspicious5153",1,1,"1_1_1_1",1,"much mental health experience peer mentor someone recovered treatment mental health work plus personal professional experience eating disorders will difficult land peer mentor position "
"6g_fiber",2,2,"2",2," equip gives bad vibes  dietitian years hloc outpatient never patient done type treatment kind assumed going business soon especially since within quality program  actually provide iop php"
"Dry-Teaching-3120",6,6,"2_1",2,"interviewing def got lot micromanaging vibes record patient sessions content every session basically already planned laid  feel great trying meet clients provide holistic individualized care even scripts sessions meant follow gave huge ick also demand know external employment fair also want know exactly hours work another employer many clients see  feels invasive"
"6g_fiber",3,3,"2_1_1",2,"toxic parts working brick mortar treatment center  camaraderie immersive learning experience provides pass thanks intel super valuable"
"meowedandmeowing",3,3,"2_1_1_1",2,"damn apt description working hloc thanks laugh"
"6g_fiber",2,2,"2_1_1_1_1",2,"haha come outpatient side  happier"
"Dry-Teaching-3120",2,2,"2_1_1_2",2,"needless say  working"
"DiplomaticRD",9,9,"1",1,"harvard chef training program  certificate stands culinary health education fundamentals hundred bucks opinion unnecessary already feel comfortable demos"
"TemperatureMental281",1,1,"1_1",1,"maybe worth   job cover know provides ceu"
"DiplomaticRD",1,1,"1_1_1",1,"know  sorry"
"TemperatureMental281",2,2,"1_1_1_1",1,"good supervisor actually already agreed cover gonna cause"
"alwaysbalancedd",5,5,"2",2,"look culinary medicine curriculum michelle hauser free pdf book"
"Cyndi_Gibs",2,2,"3",3,"culinary nutrition studio culinary program designed rdns colleagues enjoyed immensely"
"Karma_I_Two",2,2,"4",4,"worked hospital used monthly bimonthly cooking demos staff guests hospital full kitchen food safety preparation breeze weight management clinic  proper kitchen might navigate quirks plan food demonstrations current job site likely need set date sign people  equipment find way source store food safely ask someone help signups reminders inperson cooking demos fail people forget signed month ago also nice take plate  focus food demo marketing want virtually  zoom prerecord purchased small tripod cellphone will run virtual cooking classes medical students shoot everything walk steps someone help signups reminders specific questions  know cooking demos decade happy chat private forum"
"Little-Basils",3,3,"5",5,"honestly mostly just demo recipe throw info tips tricks style like knife safety"
"TemperatureMental281",1,1,"5_1",5,"demos online person"
"Little-Basils",2,2,"5_1_1",5,"person though online youtube option future"
"Sudden-Mission6557",21,21,"1",1,"hard everyone cup tea big people pleaser take stuff hard every health care professional going  negative feedback sometimes  doctors especially feedback may reflect patients stage change style"
"road2health",1,1,"1_1",1,"thank good words think"
"No-Needleworker5429",16,16,"2",2,"remind early career job change people autonomy take action inaction adults find trying harder client  setting disappointment"
"road2health",1,1,"2_1",2,"true remind"
"CholecalciferPaal",31,31,"3",3,"honestly say fuck fuck supposed  one small cog unearthly fucked machine much  help someone remember someone giving bad review  learn anything nutrition fundamentals class like okay buddy glad know everything also learned long time ago hold onto people want change  work others know patients clients problem every solution fuck   negativity  going like every practitioner work  expect every patient client like vibe either also  like every patient client end day  just hairless monkeys got sentient enough form society  dumbass hairless asses try operate fuck"
"TLC_4978",8,8,"3_1",3,"salty years experience love reply"
"awoll540",5,5,"3_2",3,"fucking agree chuck negative reviews fuck bucket"
"reidkimball",4,4,"3_3",3," whatever "
"road2health",4,4,"3_4",3,"thank feel like rallying cry"
"cuteshrimp",4,4,"3_5",3,"wow reply beautiful"
"Several-Rock344",1,1,"3_6",3," friends rdn post soooo spot fucking tired everybody giving hard time especially managers micromanage try make robots  write resident admitted write john smith white male admitted  rehab unit primary first way wrong"
"ithinkinpink93",12,12,"4",4," educate choose information sounds like person may contemplation stage charge keep using skills job well take solace"
"road2health",2,2,"4_1",4,"thank kind words"
"picklebeach2000",5,5,"5",5,"just takes time ready change  want make meaningful goals roll meet keep counseling  years appointments common shake  heard thing many times people  frustrated put work seeing like traditional medicine outcome take medication  better"
"picklebeach2000",6,6,"5_1",5,"sounds like  hoping   tried hasn led think might also ask  open learning whole process share gently mentioned  certain types change will reach result mind worked others "
"IndependentlyGreen",6,6,"6",6,"beyond stages change learn willingness willfulness cbt dbt concepts mental health will teach human behavior ever learned dietetics one hardest things accept dietitian people blame others environment around change anything improve lives people  realize beliefs actions keep achieving want feel comfortable playing blame game"
"briaairb",4,4,"7",7,"people gave advice  change people honestly first year never took advice wanted super hero everyone continued people please continued  feelings hurt  roughly month mark aha moment hit amp burnt giving much emotional energy true truly change people internal external epiphany will come soon hang"
"mar621",3,3,"8",8," become invested basically fuck people will people  part  detached feelings patients say  work outpatient deal patients couple times week rolls sleeve fast   decade will gone many experiences  zero fucks give sorry honest truth"
"i_love_icescream",3,3,"9",9,"look forward things want life free time finally separate work life know negativity hold onto"
"itscollinnotcolin",2,2,"10",10," work harder patients  hold hand spoon feed   "
"AsianSlice30_",2,2,"11",11,"educate  engage consider discharging dietetic service sound like quite ready change absolutely fine  force people equally fault  engaging  tried best effective support dietitian really  always leave door open come back service ready someone else need time using appointment time instead"
"Real-Aside-6837",2,2,"12",12,"always try meet patients patients will accomplish believe  accomplish even providing reasons making changes will largely beneficial health also negative feedback comes way shy asking questions find thoughts feeling want fully understand headspace maybe  come plan bridge gap patients dietitians expectations"
"road2health",1,1,"12_1",12,"thank reflecting"
"spacelumieree",2,2,"13",13,"fault everyone style honest met many patients  want change come try help  defensive angry   define worth work  fit bill  elsewhere"
"LibertyJubilee",2,2,"14",14,"start identify early patients  really want put effort tell early  think good fit will save much headache identify patients  start well thought questionnaire maybe good google search  help figure right questions example mom really wanted adult son eat variety turns asked important eating variety scale said  change  want change asked like work instead another example patient challenged just everything said even brought articles support saying still argued clearly good fit business debating patients low level trust prove wrong fight trust  find someone else worth"
"road2health",1,1,"14_1",14,"great advice might next step tbh"
"fauxsho77",2,2,"15",15,"turning point realizing accepting change people motivate people individual  guide woods ones take step lot patients  think job  totally fault thinking take sign stage change honestly adjust approach effort based watch rds nearing end career still accepted tend sort miserable people"
"feelin_beet",1,1,"16",16,"self protect  guidance  ready make change  anything   ask direct specific questions willing address modify helped either change approach just nutrition topic educations sort need help strategy problem solving remember  working harder  burn quickly"
"lavender_sayurii",1,1,"17",17,"honestly tell patient  seem like good fit maybe  help find someone better sometimes  click others  help someone  want help seems like  just want make problem away getting discouraged find psychodietetocs nutritional psychology someone please tell google translate  help helps navigating patients better"
"road2health",1,1,"17_1",17,"find resources area dietitics"
"lavender_sayurii",2,2,"17_1_1",17,"postgrad area many books recommend weight escape book actbased selfhelp book healthy weight loss physical fitness problems emotional eating body image think will great start"
"road2health",1,1,"17_1_1_1",17,"thank"
"SoColdInAlaska",4,4,"1",1,"expert either fair bit research patients struvite stones cautis urology notes specify stone type  confirm dealing calcium oxalate stones another type mnt include fluid intake increase urine volume mainly using water debate filtered mineral water effectiveness reducing oxalates diet important strive consistent dietary calcium intake research shows high protein intake  increase acid load causing stone recurrence moderate protein intake encouraged sounds like right track"
"cowgirldreams",1,1,"1_1",1,"awesome thank consider moderate protein intake maybe like also urology note specify type stone also high calcium level high  want restrict calcium right"
"SoColdInAlaska",3,3,"1_1_1",1,"rats stone  want restrict calcium calcium binds oxalate tract low calcium diet leads greater oxalate absorption low calcium diet means just leech calcium bones anyways increase blood values  kidneys either way reference table recommends calcium daily protein admit protein studies inconclusive"
"CoolKidsClub4One",2,2,"2",2,""
"Jealous_Ad4119",2,2,"3",3,""
"Jealous_Ad4119",2,2,"4",4,"newer episode two women toxic superfoods episodes podcasts super great turned interviewing rds doctors handle nutrition questions still find interesting informative time toxic superfoods ones know mention labs important know type stones generally avoiding oxalates actually outdated information oxalates  quite remember"
"ThinkOutsideTheBox_",2,2,"5",5,"high sodium sugar intake increases risk kidney stones young people addicted energy drinks result kidney stones diet soda requires extra work kidneys calcium supplements increase stones natural calcium sources dairy decreases risk stones citrus fruits great preventing environment kidney stones created focus first usually plenty nutrition education opportunities right alone sticks sodium high sodium diet results increased calcium urine creates stones  reduce protein check see personal trainer recommended protein seen personal trainers online recommend crazy amounts protein know controversial personally  agree reducing oxalates diet answer think oxalates like cholesterol people high cholesterol dietary cholesterol got blame found generally incorrect wrote literature review sodium intake kidney stones grad school think  vilify whole foods like spinach berries someone drinking minimal water high soda intake high meat low plants high sodium processed food intake much work first fruit vegetables decrease urine think stones urine high sodium issue oxalate issue acidity caused junk food causes calcium leach urine creating high calcium urine calcium binds everything including oxalates learned reading research"
"KickFancy",2,2,"1",1,"mean nutritional psychology  know someone grad school cohort licensed therapist also becoming dietitian mean motivational interviewing counseling patients"
"popsicle22wolves",1,1,"1_1",1,"may used wrong term oops looking courses cognitive neuroscience mechanisms around food"
"KickFancy",1,1,"1_1_1",1,"specific population people make choices make regarding food maybe mention purpose certificates"
"KickFancy",1,1,"2",2,"asked saw think answers one two questions"
"FNKTL",12,12,"1",1,"saying referrals inappropriate medical necessity lose weight worked exclusively weight management good chunk time someone feels best say healthy weight range weigh say  taught safe healthy way screen disordered eating eating disorders patients saw regardless body size someone wants make better healthier choices something makes confidence increase gonna stop  bunch red flags went tell  work capacity work eds"
"gschm0n3y",5,5,"1_1",1,"yes people  referred normal bmi medical concerns true someone wanting better positive especially ongoing medical concerns  notice red flags lot might speak disordered behaviors prevalent overweight obese folks feel uncomfortable addressing loss instances bring behaviors notice"
"FNKTL",4,4,"1_1_1",1,"work retraining thoughts around body image food dive deeper figure real reason often will say surface reason speak figure lives work figure real reasons playing kids quality life getting oxygen  pointing highlighting goals come will longterm help things  helpful lot sheets intuitive eating workbook homework appointments send additional reading podcasts highly encourage  therapy already seeing someone speak lot disordered eating behaviors led failure past gonna make healthier changes longterm health use mostly motivational interviewing sessions"
"gschm0n3y",1,1,"1_1_1_1",1,"helpful thank"
"Suspicious-Spirit621",4,4,"2",2,"patients  referred unless bmi office unless wls "
"gschm0n3y",1,1,"2_1",2,"counseling weight loss fave thing private practice want policy"
"No-Needleworker5429",4,4,"3",3,"people coming advice support help reaching goal  looking talk  looking achieve opinions  know  say want behaviors real goal feel important composition weight matter true bottom line people number scale disordered eating tendencies  referral"
"Hefty_Character7996",1,1,"4",4,"ask vision goal weight  help lose work prediabetes reduction waist circumference also build muscle "
"gschm0n3y",1,1,"4_1",4,"thank  ask parameters goal focusing parameters like labs waist circumference helped counseling loss since healthy habits usually lead losing"
"Kreos642",1,1,"5",5,"call ass treat like trial period wanna lose weight initial intake screening consul reasonable advice plan making see month lbs talk lifestyle changes made show decided record"
"gschm0n3y",1,1,"5_1",5,"hahaha super will"
"Foreign-Equipment-90",0,0,"6",6,"overweight  progress obesity increase risk weight related complications  see someone overweight help either maintain reverse excess weight huge win"
"defer-deez-nuts",99,99,"1",1,"barred speaking changes  weekly reminders speak many gonna fired anyways eff buildup dietitians actively sharing requesting stories havent cried work past week going first month rough undoing valuable work also reviewing approving nutrition education materials like tell dudes juice fiber appropriate substitute fruit gonna flip holding new materials notice several managers leave effectively fired leak press cancelling food bank contracts defered resignation gutted good third myplate dga snap staff regions  nutritionists anymore concerned edit food dyes theres regulation statue behind making ban voluntary proposed budget hhs plans eliminate routine food inspections division clue will verify whats food food dyes"
"danny_b87",21,21,"1_1",1,"lol love username combination justified rant"
"euphoria700",4,4,"1_1_1",1,"literally lold yet second"
"dinahmyte10",9,9,"1_2",1,"thank posting"
"Baby-Blue-Lily",38,38,"2",2,"just week know rolling back safety quality checks contracted shiga toxinproducing coli dodging death week"
"Asleep-Pineapple-650",7,7,"2_1",2,"contracted shigella potluck tract never terrified pull back"
"AcceptableUse1",3,3,"2_2",2,"struggling give arrow rough hit hope  feeling better"
"marebeare",2,2,"2_3",2,"goodness sorry please  well"
"Baby-Blue-Lily",13,13,"2_3_1",2,"trying  wish vomiting shitting blood anyone mean well maybe true"
"marebeare",1,1,"2_3_1_1",2,"know contracted"
"Baby-Blue-Lily",3,3,"2_3_1_1_1",2,"ordered restaurant near"
"marebeare",2,2,"2_3_1_1_1_1",2,"sorry"
"KickFancy",1,1,"2_4",2,"eat"
"Baby-Blue-Lily",2,2,"2_4_1",2,"greek tahini caesar chicken skewer lettuce kinda warm"
"KickFancy",1,1,"2_4_1_1",2,""
"[deleted]",1,1,"3",3,"removed"
"dietetics-ModTeam",3,3,"3_1",3,"comment removed offtopic"
"SnarkAdjacent",1,1,"4",4,"morale"
"Historical-Run4864",1,1,"5",5,"anyone looking transition public health something else ideas going clinical working community setting years"
"Icy_Yogurtcloset5920",1,1,"6",6,"change fns staff many dietitians taken deferred resignation offer much talent expertise  window  even begin explain unfortunate see political appointees  selected pretty sure  tell cnr farm bill even hhfka bad really bad"
"Low-Display-7681",-25,-25,"7",7,"food dyes"
"broccoliandbeans",37,37,"7_1",7," ban food dies check jessica knuricks post love"
"Asleep-Pineapple-650",10,10,"7_1_1",7,"amazing"
"broccoliandbeans",12,12,"7_1_1_1",7,"obsessed glad big following discovered page recently last weeks say something like mid followers  growing followers quick yay"
"evefue",2,2,"7_1_2",7,"thanks tip just started following"
"Nutrition_Dominatrix",16,16,"7_2",7,"exchange rolling back regulations food safety"
"Aware_Description940",6,6,"1",1,"yes  even need know  prevent work long  interfere current position  see clients  sodexo time property"
"SlowBanks",2,2,"1",1,"looking  credentialed"
"rynduhstalli",1,1,"1_1",1,"kind figuring honestly iffy currently working football team know  want long run little much stress time consuming"
"yogikitty72",1,1,"2",2,"finishing program year worked fulltime pharmaceutical industry past years research doable work hard study time mnt otherwise classes bad making career change found school offered dpd inperson evenings online good luck getting placed internship  little nervous reading challenging preceptors"
"NutritionNurd",7,7,"1",1,"absolutely useless gave keeping ches credential time plus applied adjunct teaching position required ches credential even teaching  long time  letting university "
"Moreno_Nutrition",1,1,"1_1",1,"thank asking specifically due adjunct position called  seem necessarily require might reach see much flexibility really feel much overlap competencies  imagine missing major pieces information become credentialed dietitians"
"Due_Description_1568",1,1,"1_1_1",1,"ches credential seems oriented towards someone nonpractitioner type background like someone mph may talking health  provider credential like rdn"
"Moreno_Nutrition",1,1,"1_1_1_1",1,"think general pathway traditionally yes also think nontraditional roles overlap positions seeking title"
"TLC_4978",1,1,"1_2",1,"agree stopped maintaining ches credential years ago useless"
"No_Salary_745",2,2,"2",2,"helpful necessary role mph back many years ago asked advisors  said really since getting mph degree someone  health background like  public health education end getting ches certificate easy exam  lapse  want keep ceus"
"Moreno_Nutrition",1,1,"2_1",2,"asking specifically regarding value nontraditional roles education public health helpful know thank"
"Asleep-Pineapple-650",4,4,"1",1,"thread really helpful first started private practice telehealth make difficult build rapport talk things nutrition many things factor client might shop eat cook plan talk sleep stress work make plans  add stress support good sleep  coworker really excels telehealth visits clients show pantries make sample meal together  gone route yet option hour initials hour follow ups often virtual appointments half good luck hope find helpful"
"Puzzleheaded-Iron205",2,2,"1_1",1,"helpful thank  seen thread know comes time practice good know alone"
"Asleep-Pineapple-650",2,2,"1_1_1",1,"welcome still new arena reddit threads helpful glad able help"
"birdtummy717",4,4,"2",2,"min follow ups unless almost done initials complex patients often longer know specialty area skills"
"Thick_Succotash396",1,1,"2_1",2,"agree"
"foodbringtome",2,2,"1",1,"complete quarterly day window ard mds coordinators will often use notes complete section  rely info entered mds assessment"
"Ginseekingginger",1,1,"1_1",1,"interesting section nutrition hydration caas reevaluate change within days assessment ard ard assessment diet downgraded slp choking incident another note"
"foodbringtome",1,1,"1_1_1",1,"info eval used complete mds way around mds nuanced beast completely separate evals ard marks end day review period mds answer mds questions need based documentation within days ard minus days ard counts within look back period full mds needs completed days ard  want wait day complete section sooner complete ard better course just mds scheduling  use example gtex ard assessment diet downgraded slp choking incident another note starting  complete section triggering caas based everything happened disciplines includes evals slp nursing diet texture changes significant weight changes anything relevant section instance mark yes section question asking mechanically altered diet since resident mechanically altered diet point within days redo eval long info accurate time signed recommend rds complete evals within days ard update sign care plan time eval gets captured window needed mds completion center mds coordinator role great resource even discuss  received specific training mds requirements worked ltc companies section triggering caas started seeing transition designated mds coordinator role responsible things mds"
